{
  "schema_version": "v1",
  "scope_name": "pathos_undergraduate_university_universe",
  "selection_rules": {
    "national_universities_max_numeric_rank": 50,
    "undergraduate_program_max_numeric_rank": 20,
    "tie_handling": "include_all_records_with_numeric_rank_at_or_below_cutoff",
    "institution_identity": "resolve_to_ipeds_unitid_before_deduplication"
  },
  "categories": [
    {
      "ranking_family": "national_universities",
      "category_name": "U.S. News National Universities",
      "included_in_pathos_scope": true,
      "discovery_status": "pending_phase_2",
      "exclusion_reason": null
    },
    {
      "ranking_family": "undergraduate_program",
      "category_name": "U.S. News current undergraduate program categories",
      "included_in_pathos_scope": true,
      "discovery_status": "pending_phase_2_category_inventory",
      "exclusion_reason": null
    },
    {
      "ranking_family": "global_universities",
      "category_name": "U.S. News Best Global Universities",
      "included_in_pathos_scope": false,
      "discovery_status": "not_collected",
      "exclusion_reason": "not_a_us_undergraduate_admissions_ranking"
    },
    {
      "ranking_family": "graduate_program",
      "category_name": "U.S. News Graduate School Rankings",
      "included_in_pathos_scope": false,
      "discovery_status": "not_collected",
      "exclusion_reason": "future_snapshot_family_not_in_undergraduate_scope"
    }
  ],
  "universe_status": "not_collected"
}
